BOM.csv

Item Name,Qty,Total Price (USD),Item Link,Notes
"Cherry MX Switches",6,"$0.96","https://www.amazon.com/Deftomo-Keyboard-Switches-Mechanical-Replacement/dp/B0FSWLNL21","Price for this pack of 50 switches is $7.99. 6 * $7.99 / 50 = $0.96."
"DSA Keycaps",6,"$2.25","https://www.amazon.com/Mechkeeb-Profile-Switches-Keyboard-Replacement/dp/B0BWDTBF1L","Price for this pack of 24 keycaps is $8.99. 6 * $8.99 / 24 = $2.25."
"0.91 inch 128x32 OLED Display",1,"$7.99","https://www.amazon.com/dp/B0F3CXTWZT","None"
"EC11 Rotary Encoder",1,"$1.00","https://www.amazon.com/DIYhz-Rotary-Encoder-Digital-Potentiometer/dp/B07D3DF8TK","Price for this pack of 10 rotary encoders is $9.99. $9.99 / 10 = $1.00."
"XIAO RP2040",1,"$3.99","https://www.seeedstudio.com/XIAO-RP2040-v1-0-p-5026.html","None"
"M3 bolts",4,"$0.07","https://www.amazon.com/Machine-Screws-Countersunk-Phillips-Assortment/dp/B0CCPH974T","This pack of 380 bolts has 30 bolts of each length. Dividing by the correct length only would be 4 * $6.48 / 30 = $0.86. Counting the entire product, it is 4 * $6.48 / 380 = $0.07."
"M3 heat-set threaded inserts",4,"$0.26","https://www.amazon.com/dp/B0FDKYTMZ8","Price for this pack of 100 is $6.49. 4 inserts * $6.49 / 100 = $0.26."
"3D Printed case",1,"Print it yourself","","There are 2 files - the case and the lid."
"PCB (2 layer)",1,"$2.00","https://jlcpcb.com","Needs to be manufactured by a company such as JLCPCB."
"Total",25,"$18.52","",""

README.md

## BOM

- 6x [Cherry MX Switches](https://www.amazon.com/Deftomo-Keyboard-Switches-Mechanical-Replacement/dp/B0FSWLNL21) (~$0.96)
- 6x [DSA Keycaps](https://www.amazon.com/Mechkeeb-Profile-Switches-Keyboard-Replacement/dp/B0BWDTBF1L) (~$2.25)
- 1x [0.91" 128x32 OLED Display](https://www.amazon.com/dp/B0F3CXTWZT) (~$7.99)
- 1x [EC11 Rotary Encoder](https://www.amazon.com/DIYhz-Rotary-Encoder-Digital-Potentiometer/dp/B07D3DF8TK) (~$1.00)
- 1x [XIAO RP2040](https://www.seeedstudio.com/XIAO-RP2040-v1-0-p-5026.html) (~$3.99)
- 4x [M3 bolts](https://www.amazon.com/Machine-Screws-Countersunk-Phillips-Assortment/dp/B0CCPH974T) (~$0.07)
- 4x [M3 heat-set threaded inserts](https://www.amazon.com/dp/B0FDKYTMZ8) (~$0.26)
- 1x Case (2 3D printed parts) (Print the [case](production/Case.stl) and [lid](production/Lid.stl)).
- 1x PCB (2 layer) (The gerbers are [here](production/gerbers.zip)). Can be manufactured by a company such as [JLCPCB](https://jlcpcb.com) (~$2.00).

**Estimated total: ~$18.52** (prorated from multi-packs, so you'll actually pay more up front for the full packs).